{
  "schema_version": "1.0.0",
  "run_id": "01J8ZK3W9P4Q5R6S7T8U9V0W1X",
  "run_sequence": 1842,
  "trigger_type": "event",
  "trigger_detail": { "event_id": "us_cpi_2026_07", "debounced_events": 1 },
  "generated_at": "2026-07-14T12:47:03Z",
  "is_degraded": false,
  "versions": {
    "rulebook": "1.4.0",
    "mhi_weights": "1.1.0",
    "prompt_sentiment": "v1#a3f9c2",
    "prompt_synthesis": "v1#7be014",
    "provider": "openai",
    "model": "gpt-5.5",
    "pipeline": "0.9.2",
    "pricing": "1.0.0"
  },
  "regime": {
    "state": "risk_off",
    "previous_state": "transition",
    "changed_this_run": true,
    "confidence": 0.72,
    "drivers": [
      {
        "name": "cpi_surprise",
        "weight_type": "computed",
        "weight": 0.41,
        "detail": "Core CPI +0.4% m/m vs +0.3% consensus (surprise +0.1pp)"
      },
      { "name": "risk_score_spike", "weight_type": "computed", "weight": 0.33 },
      { "name": "news_sentiment_global", "weight_type": "ordinal", "level": "major" }
    ]
  },
  "assets": [
    {
      "symbol": "BTC",
      "asset_class": "crypto",
      "price": {
        "value": 118342.5,
        "currency": "USD",
        "as_of": "2026-07-14T12:45:00Z",
        "is_stale": false,
        "venue_aggregation": "median_5"
      },
      "changes": { "6h": -2.8, "24h": -4.1, "7d": 1.2, "30d": 9.6 },
      "indicators": {
        "rsi_14": 38.2,
        "macd_state": "bearish_cross",
        "ema_20_50": "above_converging",
        "atr_pct": 3.1,
        "volume_ratio_20d": 1.84
      },
      "scores": { "trend": -0.45, "risk": 0.71, "sentiment": -0.38, "confidence": 0.66 },
      "market_health_index": 41,
      "regime_sensitivity": "high",
      "activated_rules": [
        {
          "rule_id": "cpi_hot_risk_assets_bearish",
          "strength": "major",
          "horizon": "24h",
          "decay_remaining": 0.94
        }
      ],
      "causal_links": [
        {
          "from": "us_cpi_2026_07",
          "to": "BTC",
          "direction": "bearish",
          "via_rule": "cpi_hot_risk_assets_bearish"
        }
      ],
      "human_summary_fa": "شاخص CPI آمریکا بالاتر از انتظار منتشر شد و فشار فروش کوتاه‌مدت بر بیت‌کوین وارد کرده است. حجم معاملات نزدیک به دو برابر میانگین ۲۰ روزه است و ریسک نوسان بالا ارزیابی می‌شود. روند میان‌مدت همچنان مثبت است.",
      "novelty_flags": [],
      "data_gaps": []
    },
    {
      "symbol": "ETH",
      "asset_class": "crypto",
      "price": {
        "value": 3892.4,
        "currency": "USD",
        "as_of": "2026-07-14T12:45:00Z",
        "is_stale": false,
        "venue_aggregation": "median_5"
      },
      "changes": { "6h": -3.2, "24h": -4.8, "7d": 0.4, "30d": 7.1 },
      "indicators": {
        "rsi_14": 35.6,
        "macd_state": "bearish_cross",
        "ema_20_50": "above_converging",
        "atr_pct": 3.6,
        "volume_ratio_20d": 1.71
      },
      "scores": { "trend": -0.52, "risk": 0.74, "sentiment": -0.41, "confidence": 0.63 },
      "market_health_index": 37,
      "regime_sensitivity": "high",
      "activated_rules": [
        {
          "rule_id": "cpi_hot_risk_assets_bearish",
          "strength": "major",
          "horizon": "24h",
          "decay_remaining": 0.94
        }
      ],
      "causal_links": [
        {
          "from": "us_cpi_2026_07",
          "to": "ETH",
          "direction": "bearish",
          "via_rule": "cpi_hot_risk_assets_bearish"
        }
      ],
      "human_summary_fa": "اتریوم همراه با بیت‌کوین تحت فشار فروش قرار گرفته و افت آن اندکی شدیدتر است. اندیکاتورهای کوتاه‌مدت نزولی شده‌اند اما ساختار میان‌مدت هنوز مثبت است.",
      "novelty_flags": [],
      "data_gaps": []
    },
    {
      "symbol": "GOLD",
      "asset_class": "metal",
      "price": {
        "value": 2418.7,
        "currency": "USD",
        "as_of": "2026-07-14T12:44:00Z",
        "is_stale": false
      },
      "changes": { "6h": -0.3, "24h": -0.6, "7d": 0.8, "30d": 3.4 },
      "indicators": {
        "rsi_14": 51.4,
        "macd_state": "neutral",
        "ema_20_50": "above_diverging",
        "atr_pct": 0.9,
        "volume_ratio_20d": 1.12
      },
      "scores": { "trend": 0.12, "risk": 0.38, "sentiment": -0.08, "confidence": 0.44 },
      "market_health_index": 58,
      "regime_sensitivity": "medium",
      "activated_rules": [
        {
          "rule_id": "cpi_hot_gold_regime_conditioned",
          "strength": "minor",
          "horizon": "24h",
          "decay_remaining": 0.9
        }
      ],
      "causal_links": [
        {
          "from": "us_cpi_2026_07",
          "to": "GOLD",
          "direction": "bearish",
          "via_rule": "cpi_hot_gold_regime_conditioned"
        }
      ],
      "human_summary_fa": "واکنش طلا به داده CPI محدود بوده است. در رژیم فعلی، اثر داده بر طلا با احتیاط و به‌صورت ضعیف ارزیابی می‌شود و روند میان‌مدت مثبت باقی مانده است.",
      "novelty_flags": [],
      "data_gaps": []
    },
    {
      "symbol": "WTI",
      "asset_class": "energy",
      "price": {
        "value": 71.85,
        "currency": "USD",
        "as_of": "2026-07-14T12:40:00Z",
        "is_stale": false
      },
      "changes": { "6h": -0.9, "24h": -1.4, "7d": -2.1, "30d": 1.8 },
      "indicators": {
        "rsi_14": 44.8,
        "macd_state": "bearish",
        "ema_20_50": "below_converging",
        "atr_pct": 1.7,
        "volume_ratio_20d": 0.97
      },
      "scores": { "trend": -0.18, "risk": 0.49, "sentiment": -0.12, "confidence": 0.5 },
      "market_health_index": 49,
      "regime_sensitivity": "medium",
      "activated_rules": [],
      "causal_links": [],
      "human_summary_fa": "نفت خام تحت تأثیر فضای ریسک‌گریز کمی افت کرده است. اندیکاتورها خنثی تا اندکی نزولی هستند و محرک قاعده‌محور مشخصی فعال نشده است.",
      "novelty_flags": [],
      "data_gaps": []
    },
    {
      "symbol": "USD_IRR",
      "asset_class": "fx",
      "price": {
        "value": 1123000,
        "currency": "IRT",
        "as_of": "2026-07-14T12:30:00+03:30",
        "is_stale": false
      },
      "changes": { "6h": 0.2, "24h": 0.5, "7d": 1.1, "30d": 2.7 },
      "indicators": {
        "rsi_14": 58.3,
        "macd_state": "bullish",
        "ema_20_50": "above_diverging",
        "atr_pct": 0.8,
        "volume_ratio_20d": 1.05
      },
      "scores": { "trend": 0.22, "risk": 0.35, "sentiment": 0.1, "confidence": 0.41 },
      "market_health_index": 54,
      "regime_sensitivity": "low",
      "activated_rules": [],
      "causal_links": [],
      "human_summary_fa": "بازار آزاد تهران با محرک‌های داخلی حرکت می‌کند و نسبت به فضای ریسک جهانی حساسیت پایینی دارد. روند کوتاه‌مدت اندکی صعودی است.",
      "novelty_flags": [],
      "data_gaps": []
    },
    {
      "symbol": "TOTAL_MCAP",
      "asset_class": "index",
      "price": {
        "value": 3910000000000,
        "currency": "USD",
        "as_of": "2026-07-14T12:45:00Z",
        "is_stale": false
      },
      "changes": { "6h": -2.6, "24h": -3.9, "7d": 0.9, "30d": 8.4 },
      "indicators": {
        "atr_pct": 2.8,
        "trend_state": "weakening",
        "dominance_shift": 0.3
      },
      "scores": { "trend": -0.42, "risk": 0.69, "sentiment": -0.35, "confidence": 0.6 },
      "market_health_index": 43,
      "regime_sensitivity": "high",
      "activated_rules": [
        {
          "rule_id": "cpi_hot_risk_assets_bearish",
          "strength": "major",
          "horizon": "24h",
          "decay_remaining": 0.94
        }
      ],
      "causal_links": [
        {
          "from": "us_cpi_2026_07",
          "to": "TOTAL_MCAP",
          "direction": "bearish",
          "via_rule": "cpi_hot_risk_assets_bearish"
        }
      ],
      "human_summary_fa": "ارزش کل بازار رمزارز به‌عنوان یک شاخص، همسو با بیت‌کوین کاهش یافته است. تسلط بیت‌کوین اندکی افزایش یافته که نشان از چرخش به سمت دارایی‌های کم‌ریسک‌تر درون بازار دارد.",
      "novelty_flags": [],
      "data_gaps": []
    }
  ],
  "global": {
    "fear_greed": { "value": 24, "label": "extreme_fear" },
    "btc_dominance": 56.8,
    "total_market_cap_usd": 3910000000000,
    "expectation_context": {
      "recent_surprises": [{ "event": "us_cpi_2026_07", "surprise_sigma": 1.3 }]
    },
    "onchain_context": null
  },
  "guardrail_flags": [],
  "disclaimer": "This is a market observation, not investment advice. Confidence values are system confidence, not calibrated probabilities."
}
