{
  "schema_version": "1.0.0",
  "run_id": "01J8ZM7X0A1B2C3D4E5F6G7H8J",
  "run_sequence": 1843,
  "trigger_type": "scheduled",
  "trigger_detail": { "scheduled_for": "2026-07-14T18:00:00Z" },
  "generated_at": "2026-07-14T18:02:11Z",
  "is_degraded": true,
  "versions": {
    "rulebook": "1.4.0",
    "mhi_weights": "1.1.0",
    "prompt_sentiment": "v1#a3f9c2",
    "prompt_synthesis": "v1#7be014",
    "provider": "openai",
    "model": "gpt-5.5",
    "pipeline": "0.9.2",
    "pricing": "1.0.0"
  },
  "regime": {
    "state": "risk_off",
    "previous_state": "risk_off",
    "changed_this_run": false,
    "confidence": 0.68,
    "drivers": [
      { "name": "risk_score_spike", "weight_type": "computed", "weight": 0.46 },
      { "name": "cross_asset_drawdown", "weight_type": "computed", "weight": 0.31 }
    ]
  },
  "assets": [
    {
      "symbol": "BTC",
      "asset_class": "crypto",
      "price": {
        "value": 117980.0,
        "currency": "USD",
        "as_of": "2026-07-14T17:58:00Z",
        "is_stale": false,
        "venue_aggregation": "median_5"
      },
      "changes": { "6h": -0.3, "24h": -4.4, "7d": 0.7, "30d": 9.1 },
      "indicators": {
        "rsi_14": 37.5,
        "macd_state": "bearish_cross",
        "ema_20_50": "above_converging",
        "atr_pct": 3.0,
        "volume_ratio_20d": 1.62
      },
      "scores": { "trend": -0.47, "risk": 0.7, "sentiment": null, "confidence": 0.64 },
      "market_health_index": 40,
      "regime_sensitivity": "high",
      "activated_rules": [
        {
          "rule_id": "cpi_hot_risk_assets_bearish",
          "strength": "major",
          "horizon": "24h",
          "decay_remaining": 0.62
        }
      ],
      "causal_links": [
        {
          "from": "us_cpi_2026_07",
          "to": "BTC",
          "direction": "bearish",
          "via_rule": "cpi_hot_risk_assets_bearish"
        }
      ],
      "data_gaps": []
    },
    {
      "symbol": "ETH",
      "asset_class": "crypto",
      "price": {
        "value": 3871.0,
        "currency": "USD",
        "as_of": "2026-07-14T17:58:00Z",
        "is_stale": false,
        "venue_aggregation": "median_5"
      },
      "changes": { "6h": -0.5, "24h": -5.0, "7d": -0.1, "30d": 6.6 },
      "indicators": {
        "rsi_14": 34.9,
        "macd_state": "bearish_cross",
        "ema_20_50": "above_converging",
        "atr_pct": 3.5,
        "volume_ratio_20d": 1.55
      },
      "scores": { "trend": -0.54, "risk": 0.73, "sentiment": null, "confidence": 0.61 },
      "market_health_index": 36,
      "regime_sensitivity": "high",
      "activated_rules": [
        {
          "rule_id": "cpi_hot_risk_assets_bearish",
          "strength": "major",
          "horizon": "24h",
          "decay_remaining": 0.62
        }
      ],
      "causal_links": [
        {
          "from": "us_cpi_2026_07",
          "to": "ETH",
          "direction": "bearish",
          "via_rule": "cpi_hot_risk_assets_bearish"
        }
      ],
      "data_gaps": []
    },
    {
      "symbol": "GOLD",
      "asset_class": "metal",
      "price": {
        "value": 2420.1,
        "currency": "USD",
        "as_of": "2026-07-14T17:55:00Z",
        "is_stale": false
      },
      "changes": { "6h": 0.1, "24h": -0.4, "7d": 0.9, "30d": 3.6 },
      "indicators": {
        "rsi_14": 52.0,
        "macd_state": "neutral",
        "ema_20_50": "above_diverging",
        "atr_pct": 0.9,
        "volume_ratio_20d": 1.08
      },
      "scores": { "trend": 0.14, "risk": 0.37, "sentiment": null, "confidence": 0.43 },
      "market_health_index": 59,
      "regime_sensitivity": "medium",
      "activated_rules": [],
      "causal_links": [],
      "data_gaps": []
    },
    {
      "symbol": "WTI",
      "asset_class": "energy",
      "price": {
        "value": 71.6,
        "currency": "USD",
        "as_of": "2026-07-14T17:50:00Z",
        "is_stale": false
      },
      "changes": { "6h": -0.3, "24h": -1.6, "7d": -2.4, "30d": 1.5 },
      "indicators": {
        "rsi_14": 43.9,
        "macd_state": "bearish",
        "ema_20_50": "below_converging",
        "atr_pct": 1.7,
        "volume_ratio_20d": 0.95
      },
      "scores": { "trend": -0.2, "risk": 0.5, "sentiment": null, "confidence": 0.49 },
      "market_health_index": 48,
      "regime_sensitivity": "medium",
      "activated_rules": [],
      "causal_links": [],
      "data_gaps": []
    },
    {
      "symbol": "USD_IRR",
      "asset_class": "fx",
      "price": {
        "value": 1124500,
        "currency": "IRT",
        "as_of": "2026-07-14T16:30:00+03:30",
        "is_stale": false
      },
      "changes": { "6h": 0.1, "24h": 0.6, "7d": 1.2, "30d": 2.8 },
      "indicators": {
        "rsi_14": 59.1,
        "macd_state": "bullish",
        "ema_20_50": "above_diverging",
        "atr_pct": 0.8,
        "volume_ratio_20d": 1.03
      },
      "scores": { "trend": 0.24, "risk": 0.36, "sentiment": null, "confidence": 0.4 },
      "market_health_index": 55,
      "regime_sensitivity": "low",
      "activated_rules": [],
      "causal_links": [],
      "data_gaps": []
    },
    {
      "symbol": "TOTAL_MCAP",
      "asset_class": "index",
      "price": {
        "value": 3898000000000,
        "currency": "USD",
        "as_of": "2026-07-14T17:58:00Z",
        "is_stale": false
      },
      "changes": { "6h": -0.4, "24h": -4.2, "7d": 0.5, "30d": 7.9 },
      "indicators": {
        "atr_pct": 2.7,
        "trend_state": "weakening",
        "dominance_shift": 0.2
      },
      "scores": { "trend": -0.44, "risk": 0.68, "sentiment": null, "confidence": 0.58 },
      "market_health_index": 42,
      "regime_sensitivity": "high",
      "activated_rules": [
        {
          "rule_id": "cpi_hot_risk_assets_bearish",
          "strength": "major",
          "horizon": "24h",
          "decay_remaining": 0.62
        }
      ],
      "causal_links": [
        {
          "from": "us_cpi_2026_07",
          "to": "TOTAL_MCAP",
          "direction": "bearish",
          "via_rule": "cpi_hot_risk_assets_bearish"
        }
      ],
      "data_gaps": []
    }
  ],
  "global": {
    "fear_greed": { "value": 22, "label": "extreme_fear" },
    "btc_dominance": 57.0,
    "total_market_cap_usd": 3898000000000,
    "expectation_context": {
      "recent_surprises": [{ "event": "us_cpi_2026_07", "surprise_sigma": 1.3 }]
    },
    "onchain_context": null
  },
  "guardrail_flags": [
    {
      "code": "degraded_run",
      "severity": "warning",
      "detail": "All configured LLM providers exhausted; sentiment and human summaries omitted. Deterministic outputs intact."
    }
  ],
  "disclaimer": "This is a market observation, not investment advice. Confidence values are system confidence, not calibrated probabilities."
}
