{
  "schema_version": "1.0.0",
  "run_id": "01J8ZP0Y1B2C3D4E5F6G7H8K9M",
  "run_sequence": 1844,
  "trigger_type": "scheduled",
  "trigger_detail": { "scheduled_for": "2026-07-17T06:00:00Z" },
  "generated_at": "2026-07-17T06:01:44Z",
  "is_degraded": false,
  "versions": {
    "rulebook": "1.4.0",
    "mhi_weights": "1.1.0",
    "prompt_sentiment": "v1#a3f9c2",
    "prompt_synthesis": "v1#7be014",
    "provider": "openai",
    "model": "gpt-5.5",
    "pipeline": "0.9.2",
    "pricing": "1.0.0"
  },
  "regime": {
    "state": "transition",
    "previous_state": "risk_off",
    "changed_this_run": true,
    "confidence": 0.55,
    "drivers": [
      { "name": "risk_score_normalizing", "weight_type": "computed", "weight": 0.38 },
      { "name": "news_sentiment_global", "weight_type": "ordinal", "level": "moderate" }
    ]
  },
  "assets": [
    {
      "symbol": "BTC",
      "asset_class": "crypto",
      "price": {
        "value": 119210.0,
        "currency": "USD",
        "as_of": "2026-07-17T05:58:00Z",
        "is_stale": false,
        "venue_aggregation": "median_5"
      },
      "changes": { "6h": 0.6, "24h": 1.9, "7d": 2.4, "30d": 10.2 },
      "indicators": {
        "rsi_14": 46.1,
        "macd_state": "neutral",
        "ema_20_50": "above_converging",
        "atr_pct": 2.6,
        "volume_ratio_20d": 1.15
      },
      "scores": { "trend": 0.08, "risk": 0.52, "sentiment": 0.12, "confidence": 0.57 },
      "market_health_index": 55,
      "regime_sensitivity": "high",
      "activated_rules": [],
      "causal_links": [],
      "human_summary_fa": "بیت‌کوین پس از فشار روزهای گذشته اندکی بازیابی شده و بازار وارد فاز گذار شده است. اندیکاتورها خنثی هستند.",
      "novelty_flags": [],
      "data_gaps": []
    },
    {
      "symbol": "ETH",
      "asset_class": "crypto",
      "price": {
        "value": 3945.0,
        "currency": "USD",
        "as_of": "2026-07-17T05:58:00Z",
        "is_stale": false,
        "venue_aggregation": "median_5"
      },
      "changes": { "6h": 0.7, "24h": 2.2, "7d": 1.9, "30d": 8.0 },
      "indicators": {
        "rsi_14": 47.3,
        "macd_state": "neutral",
        "ema_20_50": "above_converging",
        "atr_pct": 3.1,
        "volume_ratio_20d": 1.09
      },
      "scores": { "trend": 0.11, "risk": 0.5, "sentiment": 0.14, "confidence": 0.56 },
      "market_health_index": 56,
      "regime_sensitivity": "high",
      "activated_rules": [],
      "causal_links": [],
      "human_summary_fa": "اتریوم همسو با بیت‌کوین بازیابی شده و روند کوتاه‌مدت اندکی مثبت شده است.",
      "novelty_flags": [],
      "data_gaps": []
    },
    {
      "symbol": "GOLD",
      "asset_class": "metal",
      "price": {
        "value": 2431.0,
        "currency": "USD",
        "as_of": "2026-07-17T05:55:00Z",
        "is_stale": false
      },
      "changes": { "6h": 0.2, "24h": 0.5, "7d": 1.3, "30d": 4.0 },
      "indicators": {
        "rsi_14": 54.0,
        "macd_state": "bullish",
        "ema_20_50": "above_diverging",
        "atr_pct": 0.9,
        "volume_ratio_20d": 1.04
      },
      "scores": { "trend": 0.2, "risk": 0.33, "sentiment": 0.06, "confidence": 0.47 },
      "market_health_index": 61,
      "regime_sensitivity": "medium",
      "activated_rules": [],
      "causal_links": [],
      "human_summary_fa": "طلا با ثبات نسبی و روند میان‌مدت مثبت معامله می‌شود.",
      "novelty_flags": [],
      "data_gaps": []
    },
    {
      "symbol": "WTI",
      "asset_class": "energy",
      "price": {
        "value": 72.3,
        "currency": "USD",
        "as_of": "2026-07-17T05:50:00Z",
        "is_stale": false
      },
      "changes": { "6h": 0.3, "24h": 0.9, "7d": -1.2, "30d": 2.1 },
      "indicators": {
        "rsi_14": 47.5,
        "macd_state": "neutral",
        "ema_20_50": "below_converging",
        "atr_pct": 1.6,
        "volume_ratio_20d": 0.99
      },
      "scores": { "trend": 0.05, "risk": 0.45, "sentiment": 0.02, "confidence": 0.5 },
      "market_health_index": 52,
      "regime_sensitivity": "medium",
      "activated_rules": [],
      "causal_links": [],
      "human_summary_fa": "نفت خام در محدوده‌ای متعادل و بدون محرک قاعده‌محور مشخص در حال معامله است.",
      "novelty_flags": [],
      "data_gaps": []
    },
    {
      "symbol": "USD_IRR",
      "asset_class": "fx",
      "price": {
        "value": 1123000,
        "currency": "IRT",
        "as_of": "2026-07-16T16:30:00+03:30",
        "is_stale": true,
        "stale_reason": "tehran_market_closed_weekend"
      },
      "changes": { "6h": 0.0, "24h": 0.0, "7d": 1.1, "30d": 2.7 },
      "indicators": {
        "rsi_14": 57.0,
        "macd_state": "bullish",
        "ema_20_50": "above_diverging",
        "atr_pct": 0.7,
        "volume_ratio_20d": 0.0
      },
      "scores": { "trend": 0.18, "risk": 0.34, "sentiment": 0.05, "confidence": 0.3 },
      "market_health_index": 53,
      "regime_sensitivity": "low",
      "activated_rules": [],
      "causal_links": [],
      "human_summary_fa": "بازار آزاد تهران تعطیل است و آخرین قیمت معتبر مربوط به پیش از تعطیلی است. نرخ‌های غیررسمی شبانه ثبت شده اما در محاسبات لحاظ نشده‌اند.",
      "novelty_flags": [],
      "data_gaps": ["informal_overnight_quotes_excluded"]
    },
    {
      "symbol": "TOTAL_MCAP",
      "asset_class": "index",
      "price": {
        "value": 3955000000000,
        "currency": "USD",
        "as_of": "2026-07-17T05:58:00Z",
        "is_stale": false
      },
      "changes": { "6h": 0.6, "24h": 2.0, "7d": 2.1, "30d": 9.2 },
      "indicators": {
        "atr_pct": 2.4,
        "trend_state": "stabilizing",
        "dominance_shift": -0.1
      },
      "scores": { "trend": 0.09, "risk": 0.51, "sentiment": 0.11, "confidence": 0.56 },
      "market_health_index": 55,
      "regime_sensitivity": "high",
      "activated_rules": [],
      "causal_links": [],
      "human_summary_fa": "ارزش کل بازار رمزارز در حال تثبیت است و تسلط بیت‌کوین اندکی کاهش یافته که نشان از بازگشت تدریجی ریسک‌پذیری است.",
      "novelty_flags": [],
      "data_gaps": []
    }
  ],
  "global": {
    "fear_greed": { "value": 41, "label": "fear" },
    "btc_dominance": 56.6,
    "total_market_cap_usd": 3955000000000,
    "expectation_context": { "recent_surprises": [] },
    "onchain_context": null
  },
  "guardrail_flags": [
    {
      "code": "stale_price",
      "severity": "info",
      "detail": "USD_IRR uses the last valid pre-closure price; Tehran market closed.",
      "field": "assets[4].price"
    }
  ],
  "disclaimer": "This is a market observation, not investment advice. Confidence values are system confidence, not calibrated probabilities."
}
